E38000187,NHS Trafford CCG,Trafford,E38000187,NHS Trafford CCG,Trafford,E38000187,NHS Trafford CCG,Trafford
E38000188,NHS Vale of York CCG,Vale of York,E38000188,NHS Vale of York CCG,Vale of York,E38000188,NHS Vale of York CCG,Vale of York
E38000189,NHS Vale Royal CCG,Vale Royal,E38000189,NHS Vale Royal CCG,Vale Royal,E38000233,NHS Cheshire CCG,Cheshire
E38000190,NHS Wakefield CCG,Wakefield,E38000190,NHS Wakefield CCG,Wakefield,E38000190,NHS Wakefield CCG,Wakefield
E38000191,NHS Walsall CCG,Walsall,E38000191,NHS Walsall CCG,Walsall,E38000191,NHS Walsall CCG,Walsall
E38000192,NHS Waltham Forest CCG,Waltham Forest,E38000192,NHS Waltham Forest CCG,Waltham Forest,E38000192,NHS Waltham Forest CCG,Waltham Forest
E38000193,NHS Wandsworth CCG,Wandsworth,E38000193,NHS Wandsworth CCG,Wandsworth,E38000245,NHS South West London CCG,SW London
E38000194,NHS Warrington CCG,Warrington,E38000194,NHS Warrington CCG,Warrington,E38000194,NHS Warrington CCG,Warrington
E38000195,NHS Warwickshire North CCG,Warwickshire North,E38000195,NHS Warwickshire North CCG,Warwickshire North,E38000195,NHS Warwickshire North CCG,Warwickshire North
E38000196,NHS West Cheshire CCG,West Cheshire,E38000196,NHS West Cheshire CCG,West Cheshire,E38000233,NHS Cheshire CCG,Cheshire
E38000197,NHS West Essex CCG,West Essex,E38000197,NHS West Essex CCG,West Essex,E38000197,NHS West Essex CCG,West Essex
E38000198,NHS West Hampshire CCG,West Hampshire,E38000198,NHS West Hampshire CCG,West Hampshire,E38000198,NHS West Hampshire CCG,West Hampshire
E38000199,NHS West Kent CCG,West Kent,E38000199,NHS West Kent CCG,West Kent,E38000237,NHS Kent and Medway CCG,Kent & Medway
E38000200,NHS West Lancashire CCG,West Lancashire,E38000200,NHS West Lancashire CCG,West Lancashire,E38000200,NHS West Lancashire CCG,West Lancashire
E38000201,NHS West Leicestershire CCG,West Leicestershire,E38000201,NHS West Leicestershire CCG,West Leicestershire,E38000201,NHS West Leicestershire CCG,West Leicestershire
E38000202,NHS West London CCG,West London,E38000202,NHS West London CCG,West London,E38000202,NHS West London CCG,West London
E38000203,NHS West Norfolk CCG,West Norfolk,E38000203,NHS West Norfolk CCG,West Norfolk,E38000239,NHS Norfolk and Waveney CCG,Norfolk & Waveney
E38000204,NHS West Suffolk CCG,West Suffolk,E38000204,NHS West Suffolk CCG,West Suffolk,E38000204,NHS West Suffolk CCG,West Suffolk
E38000205,NHS Wigan Borough CCG,Wigan Borough,E38000205,NHS Wigan Borough CCG,Wigan Borough,E38000205,NHS Wigan Borough CCG,Wigan Borough
E38000206,NHS Wiltshire CCG,Wiltshire,E38000206,NHS Wiltshire CCG,Wiltshire,E38000231,"NHS Bath and North East Somerset, Swindon and Wiltshire CCG","Bath & NE Somerset, Swindon & Wiltshire"
E38000208,NHS Wirral CCG,Wirral,E38000208,NHS Wirral CCG,Wirral,E38000208,NHS Wirral CCG,Wirral
E38000210,NHS Wolverhampton CCG,Wolverhampton,E38000210,NHS Wolverhampton CCG,Wolverhampton,E38000210,NHS Wolverhampton CCG,Wolverhampton
E38000211,NHS Wyre Forest CCG,Wyre Forest,E38000211,NHS Wyre Forest CCG,Wyre Forest,E38000236,NHS Herefordshire and Worcestershire CCG,Herefordshire & Worcestershire
