CCGCode2018,CCGName2018,CCGLabel2018,CCGCode2019,CCGName2019,CCGLabel2019,CCGCode2020,CCGName2020,CCGLabel2020
E38000001,"NHS Airedale, Wharfedale and Craven CCG","Airedale, Wharfedale & Craven",E38000001,"NHS Airedale, Wharfedale and Craven CCG","Airedale, Wharfedale & Craven",E38000232,NHS Bradford District and Craven CCG,Bradford District & Craven
E38000002,NHS Ashford CCG,Ashford,E38000002,NHS Ashford CCG,Ashford,E38000237,NHS Kent and Medway CCG,Kent & Medway
E38000004,NHS Barking and Dagenham CCG,Barking & Dagenham,E38000004,NHS Barking and Dagenham CCG,Barking & Dagenham,E38000004,NHS Barking and Dagenham CCG,Barking & Dagenham
E38000005,NHS Barnet CCG,Barnet,E38000005,NHS Barnet CCG,Barnet,E38000240,NHS North Central London CCG,North Central London
E38000006,NHS Barnsley CCG,Barnsley,E38000006,NHS Barnsley CCG,Barnsley,E38000006,NHS Barnsley CCG,Barnsley
E38000007,NHS Basildon and Brentwood CCG,Basildon & Brentwood,E38000007,NHS Basildon and Brentwood CCG,Basildon & Brentwood,E38000007,NHS Basildon and Brentwood CCG,Basildon & Brentwood
E38000008,NHS Bassetlaw CCG,Bassetlaw,E38000008,NHS Bassetlaw CCG,Bassetlaw,E38000008,NHS Bassetlaw CCG,Bassetlaw
E38000009,NHS Bath and North East Somerset CCG,Bath & NE Somerset,E38000009,NHS Bath and North East Somerset CCG,Bath & NE Somerset,E38000231,"NHS Bath and North East Somerset, Swindon and Wiltshire CCG","Bath & NE Somerset, Swindon & Wiltshire"
E38000010,NHS Bedfordshire CCG,Bedfordshire,E38000010,NHS Bedfordshire CCG,Bedfordshire,E38000010,NHS Bedfordshire CCG,Bedfordshire
E38000221,NHS Berkshire West CCG,Berkshire West,E38000221,NHS Berkshire West CCG,Berkshire West,E38000221,NHS Berkshire West CCG,Berkshire West
E38000011,NHS Bexley CCG,Bexley,E38000011,NHS Bexley CCG,Bexley,E38000244,NHS South East London CCG,SE London
E38000220,NHS Birmingham and Solihull CCG,Birmingham & Solihull,E38000220,NHS Birmingham and Solihull CCG,Birmingham & Solihull,E38000220,NHS Birmingham and Solihull CCG,Birmingham & Solihull
E38000014,NHS Blackburn with Darwen CCG,Blackburn with Darwen,E38000014,NHS Blackburn with Darwen CCG,Blackburn with Darwen,E38000014,NHS Blackburn with Darwen CCG,Blackburn with Darwen
E38000015,NHS Blackpool CCG,Blackpool,E38000015,NHS Blackpool CCG,Blackpool,E38000015,NHS Blackpool CCG,Blackpool
E38000016,NHS Bolton CCG,Bolton,E38000016,NHS Bolton CCG,Bolton,E38000016,NHS Bolton CCG,Bolton
E38000018,NHS Bradford City CCG,Bradford City,E38000018,NHS Bradford City CCG,Bradford City,E38000232,NHS Bradford District and Craven CCG,Bradford District & Craven
E38000019,NHS Bradford Districts CCG,Bradford Districts,E38000019,NHS Bradford Districts CCG,Bradford Districts,E38000232,NHS Bradford District and Craven CCG,Bradford District & Craven
E38000020,NHS Brent CCG,Brent,E38000020,NHS Brent CCG,Brent,E38000020,NHS Brent CCG,Brent
E38000021,NHS Brighton and Hove CCG,Brighton & Hove,E38000021,NHS Brighton and Hove CCG,Brighton & Hove,E38000021,NHS Brighton and Hove CCG,Brighton & Hove
E38000222,"NHS Bristol, North Somerset and South Gloucestershire CCG","Bristol, North Somerset & South Gloucestershire",E38000222,"NHS Bristol, North Somerset and South Gloucestershire CCG","Bristol, North Somerset & South Gloucestershire",E38000222,"NHS Bristol, North Somerset and South Gloucestershire CCG","Bristol, North Somerset & South Gloucestershire"
E38000023,NHS Bromley CCG,Bromley,E38000023,NHS Bromley CCG,Bromley,E38000244,NHS South East London CCG,SE London
E38000223,NHS Buckinghamshire CCG,Buckinghamshire,E38000223,NHS Buckinghamshire CCG,Buckinghamshire,E38000223,NHS Buckinghamshire CCG,Buckinghamshire
E38000024,NHS Bury CCG,Bury,E38000024,NHS Bury CCG,Bury,E38000024,NHS Bury CCG,Bury
E38000025,NHS Calderdale CCG,Calderdale,E38000025,NHS Calderdale CCG,Calderdale,E38000025,NHS Calderdale CCG,Calderdale
E38000026,NHS Cambridgeshire and Peterborough CCG,Cambridgeshire & Peterborough,E38000026,NHS Cambridgeshire and Peterborough CCG,Cambridgeshire & Peterborough,E38000026,NHS Cambridgeshire and Peterborough CCG,Cambridgeshire & Peterborough
E38000027,NHS Camden CCG,Camden,E38000027,NHS Camden CCG,Camden,E38000240,NHS North Central London CCG,North Central London
E38000028,NHS Cannock Chase CCG,Cannock Chase,E38000028,NHS Cannock Chase CCG,Cannock Chase,E38000028,NHS Cannock Chase CCG,Cannock Chase
E38000029,NHS Canterbury and Coastal CCG,Canterbury & Coastal,E38000029,NHS Canterbury and Coastal CCG,Canterbury & Coastal,E38000237,NHS Kent and Medway CCG,Kent & Medway
E38000030,NHS Castle Point and Rochford CCG,Castle Point & Rochford,E38000030,NHS Castle Point and Rochford CCG,Castle Point & Rochford,E38000030,NHS Castle Point and Rochford CCG,Castle Point & Rochford
E38000031,NHS Central London (Westminster) CCG,Central London (Westminster),E38000031,NHS Central London (Westminster) CCG,Central London (Westminster),E38000031,NHS Central London (Westminster) CCG,Central London (Westminster)
E38000034,NHS Chorley and South Ribble CCG,Chorley & South Ribble,E38000034,NHS Chorley and South Ribble CCG,Chorley & South Ribble,E38000034,NHS Chorley and South Ribble CCG,Chorley & South Ribble
E38000035,NHS City and Hackney CCG,City & Hackney,E38000035,NHS City and Hackney CCG,City & Hackney,E38000035,NHS City and Hackney CCG,City & Hackney
E38000213,NHS Coastal West Sussex CCG,Coastal West Sussex,E38000213,NHS Coastal West Sussex CCG,Coastal West Sussex,E38000248,NHS West Sussex CCG,West Sussex
E38000037,NHS Corby CCG,Corby,E38000037,NHS Corby CCG,Corby,E38000242,NHS Northamptonshire CCG,Northamptonshire
E38000038,NHS Coventry and Rugby CCG,Coventry & Rugby,E38000038,NHS Coventry and Rugby CCG,Coventry & Rugby,E38000038,NHS Coventry and Rugby CCG,Coventry & Rugby
E38000039,NHS Crawley CCG,Crawley,E38000039,NHS Crawley CCG,Crawley,E38000248,NHS West Sussex CCG,West Sussex
E38000040,NHS Croydon CCG,Croydon,E38000040,NHS Croydon CCG,Croydon,E38000245,NHS South West London CCG,SW London
E38000042,NHS Darlington CCG,Darlington,E38000042,NHS Darlington CCG,Darlington,E38000247,NHS Tees Valley CCG,Tees Valley
E38000043,"NHS Dartford, Gravesham and Swanley CCG","Dartford, Gravesham & Swanley",E38000043,"NHS Dartford, Gravesham and Swanley CCG","Dartford, Gravesham & Swanley",E38000237,NHS Kent and Medway CCG,Kent & Medway
E38000044,NHS Doncaster CCG,Doncaster,E38000044,NHS Doncaster CCG,Doncaster,E38000044,NHS Doncaster CCG,Doncaster
E38000045,NHS Dorset CCG,Dorset,E38000045,NHS Dorset CCG,Dorset,E38000045,NHS Dorset CCG,Dorset
E38000046,NHS Dudley CCG,Dudley,E38000046,NHS Dudley CCG,Dudley,E38000046,NHS Dudley CCG,Dudley
E38000047,"NHS Durham Dales, Easington and Sedgefield CCG","Durham Dales, Easington & Sedgefield",E38000047,"NHS Durham Dales, Easington and Sedgefield CCG","Durham Dales, Easington & Sedgefield",E38000234,NHS County Durham CCG,County Durham
E38000048,NHS Ealing CCG,Ealing,E38000048,NHS Ealing CCG,Ealing,E38000048,NHS Ealing CCG,Ealing
E38000049,NHS East and North Hertfordshire CCG,East & North Hertfordshire,E38000049,NHS East and North Hertfordshire CCG,East & North Hertfordshire,E38000049,NHS East and North Hertfordshire CCG,East & North Hertfordshire
E38000224,NHS East Berkshire CCG,East Berkshire,E38000224,NHS East Berkshire CCG,East Berkshire,E38000224,NHS East Berkshire CCG,East Berkshire
E38000050,NHS East Lancashire CCG,East Lancashire,E38000050,NHS East Lancashire CCG,East Lancashire,E38000050,NHS East Lancashire CCG,East Lancashire
E38000051,NHS East Leicestershire and Rutland CCG,East Leicestershire & Rutland,E38000051,NHS East Leicestershire and Rutland CCG,East Leicestershire & Rutland,E38000051,NHS East Leicestershire and Rutland CCG,East Leicestershire & Rutland
E38000052,NHS East Riding of Yorkshire CCG,East Riding of Yorkshire,E38000052,NHS East Riding of Yorkshire CCG,East Riding of Yorkshire,E38000052,NHS East Riding of Yorkshire CCG,East Riding of Yorkshire
E38000053,NHS East Staffordshire CCG,East Staffordshire,E38000053,NHS East Staffordshire CCG,East Staffordshire,E38000053,NHS East Staffordshire CCG,East Staffordshire
E38000054,NHS East Surrey CCG,East Surrey,E38000054,NHS East Surrey CCG,East Surrey,E38000246,NHS Surrey Heartlands CCG,Surrey Heartlands
E38000055,"NHS Eastbourne, Hailsham and Seaford CCG","Eastbourne, Hailsham & Seaford",E38000055,"NHS Eastbourne, Hailsham and Seaford CCG","Eastbourne, Hailsham & Seaford",E38000235,NHS East Sussex CCG,East Sussex
E38000056,NHS Eastern Cheshire CCG,Eastern Cheshire,E38000056,NHS Eastern Cheshire CCG,Eastern Cheshire,E38000233,NHS Cheshire CCG,Cheshire
E38000057,NHS Enfield CCG,Enfield,E38000057,NHS Enfield CCG,Enfield,E38000240,NHS North Central London CCG,North Central London
E38000058,NHS Erewash CCG,Erewash,E38000229,NHS Derby and Derbyshire CCG,Derby & Derbyshire,E38000229,NHS Derby and Derbyshire CCG,Derby & Derbyshire
E38000059,NHS Fareham and Gosport CCG,Fareham & Gosport,E38000059,NHS Fareham and Gosport CCG,Fareham & Gosport,E38000059,NHS Fareham and Gosport CCG,Fareham & Gosport
E38000226,NHS Fylde and Wyre CCG,Fylde & Wyre,E38000226,NHS Fylde and Wyre CCG,Fylde & Wyre,E38000226,NHS Fylde and Wyre CCG,Fylde & Wyre
E38000062,NHS Gloucestershire CCG,Gloucestershire,E38000062,NHS Gloucestershire CCG,Gloucestershire,E38000062,NHS Gloucestershire CCG,Gloucestershire
E38000063,NHS Great Yarmouth and Waveney CCG,Great Yarmouth & Waveney,E38000063,NHS Great Yarmouth and Waveney CCG,Great Yarmouth & Waveney,E38000239,NHS Norfolk and Waveney CCG,Norfolk & Waveney
E38000064,NHS Greater Huddersfield CCG,Greater Huddersfield,E38000064,NHS Greater Huddersfield CCG,Greater Huddersfield,E38000064,NHS Greater Huddersfield CCG,Greater Huddersfield
E38000227,NHS Greater Preston CCG,Greater Preston,E38000227,NHS Greater Preston CCG,Greater Preston,E38000227,NHS Greater Preston CCG,Greater Preston
E38000066,NHS Greenwich CCG,Greenwich,E38000066,NHS Greenwich CCG,Greenwich,E38000244,NHS South East London CCG,SE London
E38000214,NHS Guildford and Waverley CCG,Guildford & Waverley,E38000214,NHS Guildford and Waverley CCG,Guildford & Waverley,E38000246,NHS Surrey Heartlands CCG,Surrey Heartlands
E38000068,NHS Halton CCG,Halton,E38000068,NHS Halton CCG,Halton,E38000068,NHS Halton CCG,Halton
E38000069,"NHS Hambleton, Richmondshire and Whitby CCG","Hambleton, Richmondshire & Whitby",E38000069,"NHS Hambleton, Richmondshire and Whitby CCG","Hambleton, Richmondshire & Whitby",E38000241,NHS North Yorkshire CCG,North Yorkshire
E38000070,NHS Hammersmith and Fulham CCG,Hammersmith & Fulham,E38000070,NHS Hammersmith and Fulham CCG,Hammersmith & Fulham,E38000070,NHS Hammersmith and Fulham CCG,Hammersmith & Fulham
E38000071,NHS Hardwick CCG,Hardwick,E38000229,NHS Derby and Derbyshire CCG,Derby & Derbyshire,E38000229,NHS Derby and Derbyshire CCG,Derby & Derbyshire
E38000072,NHS Haringey CCG,Haringey,E38000072,NHS Haringey CCG,Haringey,E38000240,NHS North Central London CCG,North Central London
E38000073,NHS Harrogate and Rural District CCG,Harrogate & Rural District,E38000073,NHS Harrogate and Rural District CCG,Harrogate & Rural District,E38000241,NHS North Yorkshire CCG,North Yorkshire
E38000074,NHS Harrow CCG,Harrow,E38000074,NHS Harrow CCG,Harrow,E38000074,NHS Harrow CCG,Harrow
E38000075,NHS Hartlepool and Stockton-on-Tees CCG,Hartlepool & Stockton-on-Tees,E38000075,NHS Hartlepool and Stockton-on-Tees CCG,Hartlepool & Stockton-on-Tees,E38000247,NHS Tees Valley CCG,Tees Valley
E38000076,NHS Hastings and Rother CCG,Hastings & Rother,E38000076,NHS Hastings and Rother CCG,Hastings & Rother,E38000235,NHS East Sussex CCG,East Sussex
E38000077,NHS Havering CCG,Havering,E38000077,NHS Havering CCG,Havering,E38000077,NHS Havering CCG,Havering
E38000078,NHS Herefordshire CCG,Herefordshire,E38000078,NHS Herefordshire CCG,Herefordshire,E38000236,NHS Herefordshire and Worcestershire CCG,Herefordshire & Worcestershire
E38000079,NHS Herts Valleys CCG,Herts Valleys,E38000079,NHS Herts Valleys CCG,Herts Valleys,E38000079,NHS Herts Valleys CCG,Herts Valleys
E38000080,"NHS Heywood, Middleton and Rochdale CCG","Heywood, Middleton & Rochdale",E38000080,"NHS Heywood, Middleton and Rochdale CCG","Heywood, Middleton & Rochdale",E38000080,"NHS Heywood, Middleton and Rochdale CCG","Heywood, Middleton & Rochdale"
E38000081,NHS High Weald Lewes Havens CCG,High Weald Lewes Havens,E38000081,NHS High Weald Lewes Havens CCG,High Weald Lewes Havens,E38000235,NHS East Sussex CCG,East Sussex
E38000082,NHS Hillingdon CCG,Hillingdon,E38000082,NHS Hillingdon CCG,Hillingdon,E38000082,NHS Hillingdon CCG,Hillingdon
E38000083,NHS Horsham and Mid Sussex CCG,Horsham & Mid Sussex,E38000083,NHS Horsham and Mid Sussex CCG,Horsham & Mid Sussex,E38000248,NHS West Sussex CCG,West Sussex
E38000084,NHS Hounslow CCG,Hounslow,E38000084,NHS Hounslow CCG,Hounslow,E38000084,NHS Hounslow CCG,Hounslow
E38000085,NHS Hull CCG,Hull,E38000085,NHS Hull CCG,Hull,E38000085,NHS Hull CCG,Hull
E38000086,NHS Ipswich and East Suffolk CCG,Ipswich & East Suffolk,E38000086,NHS Ipswich and East Suffolk CCG,Ipswich & East Suffolk,E38000086,NHS Ipswich and East Suffolk CCG,Ipswich & East Suffolk
E38000087,NHS Isle of Wight CCG,Isle of Wight,E38000087,NHS Isle of Wight CCG,Isle of Wight,E38000087,NHS Isle of Wight CCG,Isle of Wight
E38000088,NHS Islington CCG,Islington,E38000088,NHS Islington CCG,Islington,E38000240,NHS North Central London CCG,North Central London
E38000089,NHS Kernow CCG,Kernow,E38000089,NHS Kernow CCG,Kernow,E38000089,NHS Kernow CCG,Kernow
E38000090,NHS Kingston CCG,Kingston,E38000090,NHS Kingston CCG,Kingston,E38000245,NHS South West London CCG,SW London
E38000091,NHS Knowsley CCG,Knowsley,E38000091,NHS Knowsley CCG,Knowsley,E38000091,NHS Knowsley CCG,Knowsley
E38000092,NHS Lambeth CCG,Lambeth,E38000092,NHS Lambeth CCG,Lambeth,E38000244,NHS South East London CCG,SE London
E38000225,NHS Leeds CCG,Leeds,E38000225,NHS Leeds CCG,Leeds,E38000225,NHS Leeds CCG,Leeds
E38000097,NHS Leicester City CCG,Leicester City,E38000097,NHS Leicester City CCG,Leicester City,E38000097,NHS Leicester City CCG,Leicester City
E38000098,NHS Lewisham CCG,Lewisham,E38000098,NHS Lewisham CCG,Lewisham,E38000244,NHS South East London CCG,SE London
E38000099,NHS Lincolnshire East CCG,Lincolnshire East,E38000099,NHS Lincolnshire East CCG,Lincolnshire East,E38000238,NHS Lincolnshire CCG,Lincolnshire
E38000100,NHS Lincolnshire West CCG,Lincolnshire West,E38000100,NHS Lincolnshire West CCG,Lincolnshire West,E38000238,NHS Lincolnshire CCG,Lincolnshire
E38000101,NHS Liverpool CCG,Liverpool,E38000101,NHS Liverpool CCG,Liverpool,E38000101,NHS Liverpool CCG,Liverpool
E38000102,NHS Luton CCG,Luton,E38000102,NHS Luton CCG,Luton,E38000102,NHS Luton CCG,Luton
E38000217,NHS Manchester CCG,Manchester,E38000217,NHS Manchester CCG,Manchester,E38000217,NHS Manchester CCG,Manchester
E38000103,NHS Mansfield and Ashfield CCG,Mansfield & Ashfield,E38000103,NHS Mansfield and Ashfield CCG,Mansfield & Ashfield,E38000243,NHS Nottingham and Nottinghamshire CCG,Nottingham & Nottinghamshire
E38000104,NHS Medway CCG,Medway,E38000104,NHS Medway CCG,Medway,E38000237,NHS Kent and Medway CCG,Kent & Medway
E38000105,NHS Merton CCG,Merton,E38000105,NHS Merton CCG,Merton,E38000245,NHS South West London CCG,SW London
E38000106,NHS Mid Essex CCG,Mid Essex,E38000106,NHS Mid Essex CCG,Mid Essex,E38000106,NHS Mid Essex CCG,Mid Essex
E38000107,NHS Milton Keynes CCG,Milton Keynes,E38000107,NHS Milton Keynes CCG,Milton Keynes,E38000107,NHS Milton Keynes CCG,Milton Keynes
E38000228,NHS Morecambe Bay CCG,Morecambe Bay,E38000228,NHS Morecambe Bay CCG,Morecambe Bay,E38000228,NHS Morecambe Bay CCG,Morecambe Bay
E38000108,NHS Nene CCG,Nene,E38000108,NHS Nene CCG,Nene,E38000242,NHS Northamptonshire CCG,Northamptonshire
E38000109,NHS Newark and Sherwood CCG,Newark & Sherwood,E38000109,NHS Newark and Sherwood CCG,Newark & Sherwood,E38000243,NHS Nottingham and Nottinghamshire CCG,Nottingham & Nottinghamshire
E38000212,NHS Newcastle Gateshead CCG,Newcastle Gateshead,E38000212,NHS Newcastle Gateshead CCG,Newcastle Gateshead,E38000212,NHS Newcastle Gateshead CCG,Newcastle Gateshead
E38000113,NHS Newham CCG,Newham,E38000113,NHS Newham CCG,Newham,E38000113,NHS Newham CCG,Newham
E38000215,NHS North Cumbria CCG,North Cumbria,E38000215,NHS North Cumbria CCG,North Cumbria,E38000215,NHS North Cumbria CCG,North Cumbria
E38000115,NHS North Derbyshire CCG,North Derbyshire,E38000229,NHS Derby and Derbyshire CCG,Derby & Derbyshire,E38000229,NHS Derby and Derbyshire CCG,Derby & Derbyshire
E38000116,NHS North Durham CCG,North Durham,E38000116,NHS North Durham CCG,North Durham,E38000234,NHS County Durham CCG,County Durham
E38000117,NHS North East Essex CCG,NE Essex,E38000117,NHS North East Essex CCG,NE Essex,E38000117,NHS North East Essex CCG,NE Essex
E38000118,NHS North East Hampshire and Farnham CCG,NE Hampshire & Farnham,E38000118,NHS North East Hampshire and Farnham CCG,NE Hampshire & Farnham,E38000118,NHS North East Hampshire and Farnham CCG,NE Hampshire & Farnham
E38000119,NHS North East Lincolnshire CCG,NE Lincolnshire,E38000119,NHS North East Lincolnshire CCG,NE Lincolnshire,E38000119,NHS North East Lincolnshire CCG,NE Lincolnshire
E38000120,NHS North Hampshire CCG,North Hampshire,E38000120,NHS North Hampshire CCG,North Hampshire,E38000120,NHS North Hampshire CCG,North Hampshire
E38000121,NHS North Kirklees CCG,North Kirklees,E38000121,NHS North Kirklees CCG,North Kirklees,E38000121,NHS North Kirklees CCG,North Kirklees
E38000122,NHS North Lincolnshire CCG,North Lincolnshire,E38000122,NHS North Lincolnshire CCG,North Lincolnshire,E38000122,NHS North Lincolnshire CCG,North Lincolnshire
E38000124,NHS North Norfolk CCG,North Norfolk,E38000124,NHS North Norfolk CCG,North Norfolk,E38000239,NHS Norfolk and Waveney CCG,Norfolk & Waveney
E38000126,NHS North Staffordshire CCG,North Staffordshire,E38000126,NHS North Staffordshire CCG,North Staffordshire,E38000126,NHS North Staffordshire CCG,North Staffordshire
E38000127,NHS North Tyneside CCG,North Tyneside,E38000127,NHS North Tyneside CCG,North Tyneside,E38000127,NHS North Tyneside CCG,North Tyneside
E38000128,NHS North West Surrey CCG,North West Surrey,E38000128,NHS North West Surrey CCG,North West Surrey,E38000246,NHS Surrey Heartlands CCG,Surrey Heartlands
E38000129,"NHS Northern, Eastern and Western Devon CCG","Northern, Eastern & Western Devon",E38000230,NHS Devon CCG,Devon,E38000230,NHS Devon CCG,Devon
E38000130,NHS Northumberland CCG,Northumberland,E38000130,NHS Northumberland CCG,Northumberland,E38000130,NHS Northumberland CCG,Northumberland
E38000218,NHS Norwich CCG,Norwich,E38000218,NHS Norwich CCG,Norwich,E38000239,NHS Norfolk and Waveney CCG,Norfolk & Waveney
E38000132,NHS Nottingham City CCG,Nottingham City,E38000132,NHS Nottingham City CCG,Nottingham City,E38000243,NHS Nottingham and Nottinghamshire CCG,Nottingham & Nottinghamshire
E38000133,NHS Nottingham North and East CCG,Nottingham North & East,E38000133,NHS Nottingham North and East CCG,Nottingham North & East,E38000243,NHS Nottingham and Nottinghamshire CCG,Nottingham & Nottinghamshire
E38000134,NHS Nottingham West CCG,Nottingham West,E38000134,NHS Nottingham West CCG,Nottingham West,E38000243,NHS Nottingham and Nottinghamshire CCG,Nottingham & Nottinghamshire
E38000135,NHS Oldham CCG,Oldham,E38000135,NHS Oldham CCG,Oldham,E38000135,NHS Oldham CCG,Oldham
E38000136,NHS Oxfordshire CCG,Oxfordshire,E38000136,NHS Oxfordshire CCG,Oxfordshire,E38000136,NHS Oxfordshire CCG,Oxfordshire
E38000137,NHS Portsmouth CCG,Portsmouth,E38000137,NHS Portsmouth CCG,Portsmouth,E38000137,NHS Portsmouth CCG,Portsmouth
E38000138,NHS Redbridge CCG,Redbridge,E38000138,NHS Redbridge CCG,Redbridge,E38000138,NHS Redbridge CCG,Redbridge
E38000139,NHS Redditch and Bromsgrove CCG,Redditch & Bromsgrove,E38000139,NHS Redditch and Bromsgrove CCG,Redditch & Bromsgrove,E38000236,NHS Herefordshire and Worcestershire CCG,Herefordshire & Worcestershire
E38000140,NHS Richmond CCG,Richmond,E38000140,NHS Richmond CCG,Richmond,E38000245,NHS South West London CCG,SW London
E38000141,NHS Rotherham CCG,Rotherham,E38000141,NHS Rotherham CCG,Rotherham,E38000141,NHS Rotherham CCG,Rotherham
E38000142,NHS Rushcliffe CCG,Rushcliffe,E38000142,NHS Rushcliffe CCG,Rushcliffe,E38000243,NHS Nottingham and Nottinghamshire CCG,Nottingham & Nottinghamshire
E38000143,NHS Salford CCG,Salford,E38000143,NHS Salford CCG,Salford,E38000143,NHS Salford CCG,Salford
E38000144,NHS Sandwell and West Birmingham CCG,Sandwell & West Birmingham,E38000144,NHS Sandwell and West Birmingham CCG,Sandwell & West Birmingham,E38000144,NHS Sandwell and West Birmingham CCG,Sandwell & West Birmingham
E38000145,NHS Scarborough and Ryedale CCG,Scarborough & Ryedale,E38000145,NHS Scarborough and Ryedale CCG,Scarborough & Ryedale,E38000241,NHS North Yorkshire CCG,North Yorkshire
E38000146,NHS Sheffield CCG,Sheffield,E38000146,NHS Sheffield CCG,Sheffield,E38000146,NHS Sheffield CCG,Sheffield
E38000147,NHS Shropshire CCG,Shropshire,E38000147,NHS Shropshire CCG,Shropshire,E38000147,NHS Shropshire CCG,Shropshire
E38000150,NHS Somerset CCG,Somerset,E38000150,NHS Somerset CCG,Somerset,E38000150,NHS Somerset CCG,Somerset
E38000151,NHS South Cheshire CCG,South Cheshire,E38000151,NHS South Cheshire CCG,South Cheshire,E38000233,NHS Cheshire CCG,Cheshire
E38000152,NHS South Devon and Torbay CCG,South Devon & Torbay,E38000230,NHS Devon CCG,Devon,E38000230,NHS Devon CCG,Devon
E38000153,NHS South East Staffordshire and Seisdon Peninsula CCG,SE Staffordshire & Seisdon Peninsula,E38000153,NHS South East Staffordshire and Seisdon Peninsula CCG,SE Staffordshire & Seisdon Peninsula,E38000153,NHS South East Staffordshire and Seisdon Peninsula CCG,SE Staffordshire & Seisdon Peninsula
E38000154,NHS South Eastern Hampshire CCG,South Eastern Hampshire,E38000154,NHS South Eastern Hampshire CCG,South Eastern Hampshire,E38000154,NHS South Eastern Hampshire CCG,South Eastern Hampshire
E38000156,NHS South Kent Coast CCG,South Kent Coast,E38000156,NHS South Kent Coast CCG,South Kent Coast,E38000237,NHS Kent and Medway CCG,Kent & Medway
E38000157,NHS South Lincolnshire CCG,South Lincolnshire,E38000157,NHS South Lincolnshire CCG,South Lincolnshire,E38000238,NHS Lincolnshire CCG,Lincolnshire
E38000219,NHS South Norfolk CCG,South Norfolk,E38000219,NHS South Norfolk CCG,South Norfolk,E38000239,NHS Norfolk and Waveney CCG,Norfolk & Waveney
E38000161,NHS South Sefton CCG,South Sefton,E38000161,NHS South Sefton CCG,South Sefton,E38000161,NHS South Sefton CCG,South Sefton
E38000162,NHS South Tees CCG,South Tees,E38000162,NHS South Tees CCG,South Tees,E38000247,NHS Tees Valley CCG,Tees Valley
E38000163,NHS South Tyneside CCG,South Tyneside,E38000163,NHS South Tyneside CCG,South Tyneside,E38000163,NHS South Tyneside CCG,South Tyneside
E38000164,NHS South Warwickshire CCG,South Warwickshire,E38000164,NHS South Warwickshire CCG,South Warwickshire,E38000164,NHS South Warwickshire CCG,South Warwickshire
E38000165,NHS South West Lincolnshire CCG,South West Lincolnshire,E38000165,NHS South West Lincolnshire CCG,South West Lincolnshire,E38000238,NHS Lincolnshire CCG,Lincolnshire
E38000166,NHS South Worcestershire CCG,South Worcestershire,E38000166,NHS South Worcestershire CCG,South Worcestershire,E38000236,NHS Herefordshire and Worcestershire CCG,Herefordshire & Worcestershire
E38000167,NHS Southampton CCG,Southampton,E38000167,NHS Southampton CCG,Southampton,E38000167,NHS Southampton CCG,Southampton
E38000168,NHS Southend CCG,Southend,E38000168,NHS Southend CCG,Southend,E38000168,NHS Southend CCG,Southend
E38000169,NHS Southern Derbyshire CCG,Southern Derbyshire,E38000229,NHS Derby and Derbyshire CCG,Derby & Derbyshire,E38000229,NHS Derby and Derbyshire CCG,Derby & Derbyshire
E38000170,NHS Southport and Formby CCG,Southport & Formby,E38000170,NHS Southport and Formby CCG,Southport & Formby,E38000170,NHS Southport and Formby CCG,Southport & Formby
E38000171,NHS Southwark CCG,Southwark,E38000171,NHS Southwark CCG,Southwark,E38000244,NHS South East London CCG,SE London
E38000172,NHS St Helens CCG,St Helens,E38000172,NHS St Helens CCG,St Helens,E38000172,NHS St Helens CCG,St Helens
E38000173,NHS Stafford and Surrounds CCG,Stafford & Surrounds,E38000173,NHS Stafford and Surrounds CCG,Stafford & Surrounds,E38000173,NHS Stafford and Surrounds CCG,Stafford & Surrounds
E38000174,NHS Stockport CCG,Stockport,E38000174,NHS Stockport CCG,Stockport,E38000174,NHS Stockport CCG,Stockport
E38000175,NHS Stoke on Trent CCG,Stoke on Trent,E38000175,NHS Stoke on Trent CCG,Stoke on Trent,E38000175,NHS Stoke on Trent CCG,Stoke on Trent
E38000176,NHS Sunderland CCG,Sunderland,E38000176,NHS Sunderland CCG,Sunderland,E38000176,NHS Sunderland CCG,Sunderland
E38000177,NHS Surrey Downs CCG,Surrey Downs,E38000177,NHS Surrey Downs CCG,Surrey Downs,E38000246,NHS Surrey Heartlands CCG,Surrey Heartlands
E38000178,NHS Surrey Heath CCG,Surrey Heath,E38000178,NHS Surrey Heath CCG,Surrey Heath,E38000178,NHS Surrey Heath CCG,Surrey Heath
E38000179,NHS Sutton CCG,Sutton,E38000179,NHS Sutton CCG,Sutton,E38000245,NHS South West London CCG,SW London
E38000180,NHS Swale CCG,Swale,E38000180,NHS Swale CCG,Swale,E38000237,NHS Kent and Medway CCG,Kent & Medway
E38000181,NHS Swindon CCG,Swindon,E38000181,NHS Swindon CCG,Swindon,E38000231,"NHS Bath and North East Somerset, Swindon and Wiltshire CCG","Bath & NE Somerset, Swindon & Wiltshire"
E38000182,NHS Tameside and Glossop CCG,Tameside & Glossop,E38000182,NHS Tameside and Glossop CCG,Tameside & Glossop,E38000182,NHS Tameside and Glossop CCG,Tameside & Glossop
E38000183,NHS Telford and Wrekin CCG,Telford & Wrekin,E38000183,NHS Telford and Wrekin CCG,Telford & Wrekin,E38000183,NHS Telford and Wrekin CCG,Telford & Wrekin
E38000184,NHS Thanet CCG,Thanet,E38000184,NHS Thanet CCG,Thanet,E38000237,NHS Kent and Medway CCG,Kent & Medway
E38000185,NHS Thurrock CCG,Thurrock,E38000185,NHS Thurrock CCG,Thurrock,E38000185,NHS Thurrock CCG,Thurrock
E38000186,NHS Tower Hamlets CCG,Tower Hamlets,E38000186,NHS Tower Hamlets CCG,Tower Hamlets,E38000186,NHS Tower Hamlets CCG,Tower Hamlets
